{
  "schema_version": "1.0.0",
  "policy_version": "impact-policy-v1",
  "paper": {
    "id": "paper:doi:10.1145/3428261",
    "title": "On the unusual effectiveness of type-aware operator mutations for testing SMT solvers",
    "authors": [
      "Dominik Winterer",
      "Chengyu Zhang",
      "Zhendong Su"
    ],
    "year": 2020,
    "venue": "Proc. ACM Program. Lang.",
    "doi": "10.1145/3428261",
    "url": "https://doi.org/10.1145/3428261"
  },
  "summary": {
    "text": "Type-aware operator mutation tests SMT solvers by mutating operators of conforming types within seed formulas to produce well-typed mutants used as test cases. Realised in OpFuzz and applied to Z3 and CVC4, it proved unusually effective: over a year the authors reported 1,092 bugs, of which 819 were confirmed and 685 fixed, spanning soundness bugs, invalid model bugs and crashes across many logics and configurations. A follow-up study found the bugs were high quality, often affecting core components; 184 of the confirmed bugs were soundness bugs and 489 occurred in the solvers' default modes.",
    "relationship_to_sqlancer": "Mutation-based testing for solvers; SQLancer is cited among the testing work it relates to.",
    "is_model_generated": true,
    "grounded_in_source": true,
    "written_from": "abstract",
    "written_from_url": "https://doi.org/10.1145/3428261",
    "source_sha256": "sha256:c2ba0ca274e41fe2cdf7d4111aa0dcfcd999763342ffbadb9dcb077a8b1c97d8",
    "supporting_excerpts": [
      "We propose type-aware operator mutation, a simple, but unusually effective approach for testing SMT solvers.",
      "Type-aware operator mutations are unusually effective: During one year of extensive testing with OpFuzz, we reported 1092 bugs on Z3’s and CVC4’s respective GitHub issue trackers, out of which 819 unique bugs were confirmed and 685 of the confirmed bugs were fixed by the developers.",
      "Among the 819 confirmed bugs found by OpFuzz,184 were soundness bugs, the most critical bugs in SMT solvers,and 489 were in the default modes of the solvers."
    ],
    "model": "claude-opus-5",
    "generated_by": "claude_code_session",
    "classifier_version": null,
    "generated_at": "2026-09-07T02:39:53Z"
  },
  "evidence": [
    {
      "relationship": "references",
      "title": "Cites SQLancer",
      "value": "yes",
      "method": "citation_graph",
      "techniques": [
        "norec"
      ],
      "sources": [
        {
          "source_url": "https://www.semanticscholar.org/paper/ab6addb4b50a1af3f78fea402980648135d3b8c9",
          "source_type": "paper",
          "excerpt": null,
          "excerpt_is_verbatim": false,
          "note": "Semantic Scholar records this paper as citing the publication that introduced Non-optimizing Reference Engine Construction (NoREC).",
          "retrieved_at": "2026-09-06T15:33:21Z"
        }
      ]
    }
  ]
}
