{
  "schema_version": "1.0.0",
  "policy_version": "impact-policy-v1",
  "paper": {
    "id": "paper:arxiv:2607.09072",
    "title": "Agentic Proof and Property-Based Testing via Property-Templates in Data-Intensive Computing",
    "authors": [
      "Seongmin Lee",
      "Yaoxuan Wu",
      "Miryung Kim"
    ],
    "year": 2026,
    "venue": null,
    "doi": null,
    "url": "https://arxiv.org/abs/2607.09072"
  },
  "summary": {
    "text": "A study of recurring correctness properties in Apache Spark, expressed as parameterised property templates with holes. The authors use the templates in a dual-track framework that both proves properties in the Lean 4 theorem prover and instantiates them as executable PySpark property-based tests. They report that templates raise agentic proof success by up to 2.6x, cut proof hallucinations by 59%, and reduce intent misalignments in synthesised tests from 22 to 1.",
    "relationship_to_sqlancer": "Testing for data-intensive systems rather than for DBMSs, and the work is not built on SQLancer; the abstract compares against a Spark fuzzer, not against SQLancer.",
    "is_model_generated": true,
    "grounded_in_source": true,
    "written_from": "abstract",
    "written_from_url": "https://arxiv.org/abs/2607.09072",
    "source_sha256": "sha256:efc9523e6e62c6d769b4d26f8bd6fbb346d09d82a81884bbccdaba41fc62d9b7",
    "supporting_excerpts": [
      "We design an agentic, dual-track validation framework that uses property templates to formally verify correctness in the Lean 4 theorem prover and instantiate PBT templates as executable PySpark tests.",
      "Template-guided synthesis further exceeds a state-of-the-art Spark fuzzer and approaches unguided LLM-based PBT on code coverage."
    ],
    "model": "claude-opus-5",
    "generated_by": "claude_code_session",
    "classifier_version": null,
    "generated_at": "2026-09-07T02:24:18Z"
  },
  "evidence": [
    {
      "relationship": "references",
      "title": "Cites SQLancer",
      "value": "yes",
      "method": "citation_graph",
      "techniques": [
        "norec",
        "tlp"
      ],
      "sources": [
        {
          "source_url": "https://arxiv.org/abs/2607.09072",
          "source_type": "paper_citation_context",
          "excerpt": "On the testing side, SQLancer detects logic and optimization bugs in database engines through constructed oracles such as query partitioning and a non-optimizing reference engine [28], [29].",
          "excerpt_is_verbatim": true,
          "note": "Sentence in this paper citing Non-optimizing Reference Engine Construction (NoREC), as indexed by Semantic Scholar.",
          "retrieved_at": "2026-09-06T15:09:10Z"
        }
      ]
    }
  ]
}
