{
  "schema_version": "1.0.0",
  "policy_version": "impact-policy-v1",
  "paper": {
    "id": "paper:doi:10.1109/icccs65393.2025.11069832",
    "title": "OptionFuzz: The Fuzzer with Coverage-Guided Dynamic Configuration Scheduling",
    "authors": [
      "Lang Chu",
      "Minhuan Huang",
      "Xiang Li",
      "Yuanping Nie",
      "Wenyu Zhen",
      "Qian Yan"
    ],
    "year": 2025,
    "venue": "International Conference on Communication, Computing & Security",
    "doi": "10.1109/icccs65393.2025.11069832",
    "url": "https://doi.org/10.1109/icccs65393.2025.11069832"
  },
  "summary": {
    "text": "OptionFuzz explores a target program's configuration space during fuzzing, on the grounds that configuration often determines which execution paths are reachable. The authors note that generation-based configuration exploration has been successful but depends on formal documentation and lacks scheduling strategies. OptionFuzz generates configurations through a Markov decision process driven by edge coverage, then schedules them using function coverage. Across nine real-world programs it explored 46.9% more execution paths than traditional fuzzers and found 17 configuration-triggered crashes.",
    "relationship_to_sqlancer": "General configuration-aware fuzzing; SQLancer appears among the cited testing work rather than being used.",
    "is_model_generated": true,
    "grounded_in_source": true,
    "written_from": "abstract",
    "written_from_url": "https://doi.org/10.1109/icccs65393.2025.11069832",
    "source_sha256": "sha256:0aea14880eeb9aa06576e7f4606020e4d64b094041978dd86554d5810838837c",
    "supporting_excerpts": [
      "However, these approaches also face challenges, such as dependence on formal documentation and a lack of configuration scheduling strategies.",
      "In this paper, we propose OptionFuzz, a configuration-aware fuzzing framework based on generation, designed to address some of the limitations of previous approaches.",
      "The framework first generates configurations through a Markov decision process based on edge coverage analysis, followed by configuration scheduling guided by function coverage analysis."
    ],
    "model": "claude-opus-5",
    "generated_by": "claude_code_session",
    "classifier_version": null,
    "generated_at": "2026-09-07T02:30:18Z"
  },
  "evidence": [
    {
      "relationship": "references",
      "title": "Cites SQLancer",
      "value": "yes",
      "method": "citation_graph",
      "techniques": [
        "pqs"
      ],
      "sources": [
        {
          "source_url": "https://doi.org/10.1109/icccs65393.2025.11069832",
          "source_type": "paper_citation_context",
          "excerpt": "The second aspect aims to expand the application of fuzzing to more targets, such as operating systems[9–12], virtual machine managers[13], network protocols[13, 14], database systems[15, 16], and even autonomous vehicles[17].",
          "excerpt_is_verbatim": true,
          "note": "Sentence in this paper citing Pivoted Query Synthesis (PQS), as indexed by Semantic Scholar.",
          "retrieved_at": "2026-09-06T15:09:10Z"
        }
      ]
    }
  ]
}
