{
  "schema_version": "1.0.0",
  "policy_version": "impact-policy-v1",
  "paper": {
    "id": "paper:doi:10.1145/3395032.3395322",
    "title": "Testing query execution engines with mutations",
    "authors": [
      "Xinyue Chen",
      "Chenglong Wang",
      "Alvin Cheung"
    ],
    "year": 2020,
    "venue": "DBTest@SIGMOD",
    "doi": "10.1145/3395032.3395322",
    "url": "https://doi.org/10.1145/3395032.3395322"
  },
  "summary": {
    "text": "MutaSQL finds correctness bugs in SQL execution engines by mutating a query Q over a database D into a query Q' that should return the same result on D, then comparing what the engine returns for each. The motivation is that validating a query execution engine is inherently hard given the complexity of optimizers, and that the cost of testing slows development iteration and lets bugs reach production. Evaluated on SQLite, it reproduced 34 known bugs from earlier versions and found a new one in the then-current release.",
    "relationship_to_sqlancer": "An equivalent-query mutation oracle for SQL engines, the same idea as SQLancer's transformation-based oracles, which it cites.",
    "is_model_generated": true,
    "grounded_in_source": true,
    "written_from": "abstract",
    "written_from_url": "https://doi.org/10.1145/3395032.3395322",
    "source_sha256": "sha256:1d10d3b844cda046f7732af2066bf6a14ad5c578f35b048a3ab6ffd743c7c080",
    "supporting_excerpts": [
      "However, due to the complex nature of query optimizers, validating the correctness of a query execution engine is inherently challenging.",
      "To address this challenge, we propose a tool, MutaSQL, that can quickly discover correctness bugs in SQL execution engines.",
      "MutaSQL generates test cases by mutating a query Q over database D into a query Q′ that should evaluate to the same result as Q on D."
    ],
    "model": "claude-opus-5",
    "generated_by": "claude_code_session",
    "classifier_version": null,
    "generated_at": "2026-09-07T02:39:53Z"
  },
  "evidence": [
    {
      "relationship": "references",
      "title": "Cites SQLancer",
      "value": "yes",
      "method": "citation_graph",
      "techniques": [
        "pqs"
      ],
      "sources": [
        {
          "source_url": "https://doi.org/10.1145/3395032.3395322",
          "source_type": "paper_citation_context",
          "excerpt": "Meanwhile, pivot query synthesis (PQS) [3] is a new testing algorithm that also utilizes equivalence mutation so that the mutated query contains a specific row in the original output.",
          "excerpt_is_verbatim": true,
          "note": "Sentence in this paper citing Pivoted Query Synthesis (PQS), as indexed by Semantic Scholar.",
          "retrieved_at": "2026-09-06T15:09:10Z"
        }
      ]
    }
  ]
}
