{
  "schema_version": "1.0.0",
  "policy_version": "impact-policy-v1",
  "paper": {
    "id": "paper:doi:10.1145/3650212.3680318",
    "title": "DBStorm: Generating Various Effective Workloads for Testing Isolation Levels",
    "authors": [
      "Keqiang Li",
      "Siyang Weng",
      "Lyu Ni",
      "Chengcheng Yang",
      "Rong Zhang",
      "Xuan Zhou",
      "Aoying Zhou"
    ],
    "year": 2024,
    "venue": "International Symposium on Software Testing and Analysis",
    "doi": "10.1145/3650212.3680318",
    "url": "https://doi.org/10.1145/3650212.3680318"
  },
  "summary": {
    "text": "DBStorm generates workloads for testing isolation levels, which act as the correctness contract between applications and DBMSs. The authors identify three requirements — black-box testing of closed-source systems, avoiding redundant and ineffective tests, and distinguishing between isolation levels — and address them by studying 15 popular DBMSs, finding they share a generic conflict-graph framework. DBStorm adds lightweight data state mirroring so generated operations touch exactly the intended records, a history-independent method for producing dissimilar conflict graphs, and implantation-based orchestration of conflicting accesses. It found 33 bugs.",
    "relationship_to_sqlancer": "Isolation-level testing alongside the query-result testing SQLancer performs, which it cites.",
    "is_model_generated": true,
    "grounded_in_source": true,
    "written_from": "abstract",
    "written_from_url": "https://doi.org/10.1145/3650212.3680318",
    "source_sha256": "sha256:f21476e19d09b0b2ea524ed75552576bd1d6c2c197365e4ab759061911199aaf",
    "supporting_excerpts": [
      "Isolation level (IL) acts as a correctness contract between applications and DBMSs.",
      "For black-box testing, we investigate the IL implementations of 15 popular DBMSs and discover that they follow a generic framework that utilizes conflict graphs to manage all conflicts of a workload, and performs a verification policy to prevent non-serializable anomalies.",
      "Practically, we have successfully found 33 bugs in popular DBMSs."
    ],
    "model": "claude-opus-5",
    "generated_by": "claude_code_session",
    "classifier_version": null,
    "generated_at": "2026-09-07T02:33:22Z"
  },
  "evidence": [
    {
      "relationship": "references",
      "title": "Cites SQLancer",
      "value": "yes",
      "method": "citation_graph",
      "techniques": [
        "pqs",
        "qpg"
      ],
      "sources": [
        {
          "source_url": "https://www.semanticscholar.org/paper/e54a5920715b453038a64e65a8c06fa4ce1199db",
          "source_type": "paper",
          "excerpt": null,
          "excerpt_is_verbatim": false,
          "note": "Semantic Scholar records this paper as citing the publication that introduced Pivoted Query Synthesis (PQS), Query Plan Guidance (QPG).",
          "retrieved_at": "2026-09-06T15:09:10Z"
        },
        {
          "source_url": "https://www.semanticscholar.org/paper/1b209b2da737fd26c50a2cb9116c73c9d1db904e",
          "source_type": "paper_citation_context",
          "excerpt": "We compare DBStorm with three state-of-the-art DBMS fuzzers on workload validity and code coverage, including two generationbased fuzzers SQLSmith [12] and SQLancer [37], and one mutationbased fuzzer Squirrel [50].",
          "excerpt_is_verbatim": true,
          "note": "Sentence in this paper citing Pivoted Query Synthesis (PQS), as indexed by Semantic Scholar.",
          "retrieved_at": "2026-09-06T15:09:10Z"
        },
        {
          "source_url": "https://www.semanticscholar.org/paper/1b209b2da737fd26c50a2cb9116c73c9d1db904e",
          "source_type": "paper_citation_context",
          "excerpt": ", primary-foreign key constraints, so the generated workload should comply with these constraints, which is a tough thing considering the generation efficiency [18, 37, 41, 50].",
          "excerpt_is_verbatim": true,
          "note": "Sentence in this paper citing Pivoted Query Synthesis (PQS), as indexed by Semantic Scholar.",
          "retrieved_at": "2026-09-06T15:09:10Z"
        },
        {
          "source_url": "https://www.semanticscholar.org/paper/1b209b2da737fd26c50a2cb9116c73c9d1db904e",
          "source_type": "paper_citation_context",
          "excerpt": "Though an automatic workload generation is imperative, current work is mainly designed for query processing instead of transaction processing [12, 28, 37, 41, 50].",
          "excerpt_is_verbatim": true,
          "note": "Sentence in this paper citing Pivoted Query Synthesis (PQS), as indexed by Semantic Scholar.",
          "retrieved_at": "2026-09-06T15:09:10Z"
        },
        {
          "source_url": "https://www.semanticscholar.org/paper/1b209b2da737fd26c50a2cb9116c73c9d1db904e",
          "source_type": "paper_citation_context",
          "excerpt": "SQLancer [37] generates queries to fetch a specific target row.",
          "excerpt_is_verbatim": true,
          "note": "Sentence in this paper citing Pivoted Query Synthesis (PQS), as indexed by Semantic Scholar.",
          "retrieved_at": "2026-09-06T15:09:10Z"
        }
      ]
    },
    {
      "relationship": "describes_as_state_of_the_art",
      "title": "Calls SQLancer state of the art",
      "value": "yes",
      "method": "deterministic",
      "techniques": [
        "pqs"
      ],
      "sources": [
        {
          "source_url": "https://www.semanticscholar.org/paper/1b209b2da737fd26c50a2cb9116c73c9d1db904e",
          "source_type": "paper_citation_context",
          "excerpt": "We compare DBStorm with three state-of-the-art DBMS fuzzers on workload validity and code coverage, including two generationbased fuzzers SQLSmith [12] and SQLancer [37], and one mutationbased fuzzer Squirrel [50].",
          "excerpt_is_verbatim": true,
          "note": "Sentence in this paper describing Pivoted Query Synthesis (PQS) as state of the art.",
          "retrieved_at": "2026-09-06T15:09:10Z"
        }
      ]
    }
  ]
}
