{
  "schema_version": "1.0.0",
  "policy_version": "impact-policy-v1",
  "paper": {
    "id": "paper:doi:10.1109/icse55347.2025.00003",
    "title": "Coni: Detecting Database Connector Bugs via State-Aware Test Case Generation",
    "authors": [
      "Wenqian Deng",
      "Jie Liang",
      "Zhiyong Wu",
      "Jingzhou Fu",
      "Mingzhe Wang",
      "Yu Jiang"
    ],
    "year": 2025,
    "venue": "International Conference on Software Engineering",
    "doi": "10.1109/icse55347.2025.00003",
    "url": "https://doi.org/10.1109/icse55347.2025.00003"
  },
  "summary": {
    "text": "CONI targets database connectors, the client libraries applications use to talk to a DBMS. The authors note that existing DBMS fuzzing focuses on SQL generation and exercises only a small subset of connector interfaces, so it does not transfer, and that the hard part is generating semantically correct cases that drive the connector through its state transitions. CONI derives a connector state model from the standard specification, generates interface call sequences covering those transitions, and compares results against a reference connector. Across five JDBC connectors it reported 44 previously unknown bugs, 34 confirmed.",
    "relationship_to_sqlancer": "Extends differential testing to the connector layer, arguing that DBMS fuzzers such as SQLancer do not reach it.",
    "is_model_generated": true,
    "grounded_in_source": true,
    "written_from": "abstract",
    "written_from_url": "https://doi.org/10.1109/icse55347.2025.00003",
    "source_sha256": "sha256:577bb9050362a889533833c42a3f3c2e18878e8047d3724a1659f3e39ac8447d",
    "supporting_excerpts": [
      "However, existing DBMS fuzzing works cannot be directly applied to testing database connectors as they mainly focus on SQL generation and use a small subset of connector interfaces.",
      "To address that, we propose CONI, a framework designed for detecting logic bugs of database connectors with state-aware test case generation.",
      "In total, Coni reported 44 previously unknown bugs, of which 34 have been confirmed."
    ],
    "model": "claude-opus-5",
    "generated_by": "claude_code_session",
    "classifier_version": null,
    "generated_at": "2026-09-07T02:28:35Z"
  },
  "evidence": [
    {
      "relationship": "references",
      "title": "Cites SQLancer",
      "value": "yes",
      "method": "citation_graph",
      "techniques": [
        "pqs"
      ],
      "sources": [
        {
          "source_url": "https://doi.org/10.1109/icse55347.2025.00003",
          "source_type": "paper_citation_context",
          "excerpt": "For example, SQL ANCER [11] generates valid SQL queries based on AST.",
          "excerpt_is_verbatim": true,
          "note": "Sentence in this paper citing Pivoted Query Synthesis (PQS), as indexed by Semantic Scholar.",
          "retrieved_at": "2026-09-06T15:09:10Z"
        },
        {
          "source_url": "https://doi.org/10.1109/icse55347.2025.00003",
          "source_type": "paper_citation_context",
          "excerpt": "For example, SQL ANCER [11] relies on JDBC solely to execute SQL queries and retrieve results, without exploring additional functionalities like modifying configuration properties or batch execution.",
          "excerpt_is_verbatim": true,
          "note": "Sentence in this paper citing Pivoted Query Synthesis (PQS), as indexed by Semantic Scholar.",
          "retrieved_at": "2026-09-06T15:09:10Z"
        },
        {
          "source_url": "https://doi.org/10.1109/icse55347.2025.00003",
          "source_type": "paper_citation_context",
          "excerpt": "On the one hand, most fuzzers primarily concentrate on generating effective SQL queries [10, 11, 12, 13, 14], whereas database connectors are not directly involved in the execution of these queries.",
          "excerpt_is_verbatim": true,
          "note": "Sentence in this paper citing Pivoted Query Synthesis (PQS), as indexed by Semantic Scholar.",
          "retrieved_at": "2026-09-06T15:09:10Z"
        },
        {
          "source_url": "https://doi.org/10.1109/icse55347.2025.00003",
          "source_type": "paper_citation_context",
          "excerpt": "When applying fuzzing techniques to test DBMSs, the main challenge is to generate correct and effective SQL queries [11, 12, 13, 35, 36, 37].",
          "excerpt_is_verbatim": true,
          "note": "Sentence in this paper citing Pivoted Query Synthesis (PQS), as indexed by Semantic Scholar.",
          "retrieved_at": "2026-09-06T15:09:10Z"
        },
        {
          "source_url": "https://doi.org/10.1109/icse55347.2025.00003",
          "source_type": "paper_citation_context",
          "excerpt": "In addition, SQL ANCER [11] is a popular open-source tool for testing databases using JDBC.",
          "excerpt_is_verbatim": true,
          "note": "Sentence in this paper citing Pivoted Query Synthesis (PQS), as indexed by Semantic Scholar.",
          "retrieved_at": "2026-09-06T15:09:10Z"
        }
      ]
    }
  ]
}
