{
  "schema_version": "1.0.0",
  "policy_version": "impact-policy-v1",
  "paper": {
    "id": "paper:doi:10.1109/icst60714.2024.00012",
    "title": "Differential Optimization Testing of Gremlin-Based Graph Database Systems",
    "authors": [
      "Yingying Zheng",
      "Wensheng Dou",
      "Leile Tang",
      "Ziyu Cui",
      "Jiansen Song",
      "Ziyue Cheng",
      "Wei Wang",
      "Jun Wei",
      "Hua Zhong",
      "Tao Huang"
    ],
    "year": 2024,
    "venue": "International Conference on Information Control Systems & Technologies",
    "doi": "10.1109/icst60714.2024.00012",
    "url": "https://doi.org/10.1109/icst60714.2024.00012"
  },
  "summary": {
    "text": "Differential Optimization Testing finds optimization bugs in Gremlin-based graph database systems by running the same Gremlin query under two different optimization configurations on the same system and checking that both produce the same results; a difference indicates an optimization bug. An optimization-guided approach steers testing toward more optimization strategies and more graph features. Across Neo4j, OrientDB, JanusGraph, HugeGraph, TinkerGraph and ArcadeDB it found 28 unique optimization bugs, 16 confirmed as previously unknown.",
    "relationship_to_sqlancer": "Varies optimization settings to build an oracle within one system, the same strategy SQLancer's optimizer-focused oracles use, applied to graph databases.",
    "is_model_generated": true,
    "grounded_in_source": true,
    "written_from": "abstract",
    "written_from_url": "https://doi.org/10.1109/icst60714.2024.00012",
    "source_sha256": "sha256:f43f0cf0f0d6b57f7c2980fb322c86e17e9db4c3471d6c6f50313bc1e2a8ab83",
    "supporting_excerpts": [
      "In this paper, we propose Differential Optimization Testing (DOT), an effective and automated approach to detect optimization bugs in GDBs that adopt Gremlin as their query language.",
      "The main idea of DOT is that, given a Gremlin query $Q$, we execute it on the target GDB with two different optimization configurations and then verify whether they can compute the same query results for query $Q$.",
      "In total, we have found 28 unique optimization bugs, 16 of which have been confirmed as previously-unknown bugs."
    ],
    "model": "claude-opus-5",
    "generated_by": "claude_code_session",
    "classifier_version": null,
    "generated_at": "2026-09-07T02:33:22Z"
  },
  "evidence": [
    {
      "relationship": "references",
      "title": "Cites SQLancer",
      "value": "yes",
      "method": "citation_graph",
      "techniques": [
        "pqs",
        "norec",
        "tlp",
        "qpg"
      ],
      "sources": [
        {
          "source_url": "https://doi.org/10.1109/icst60714.2024.00012",
          "source_type": "paper_citation_context",
          "excerpt": "Some approaches [20], [21], [25] (e.g., NoREC [21]) utilizes metamorphic testing for ﬁnding logic bugs in relational DBMSs. Query generation [17], [54] (e.g., SQLsmith [17]) and generic fuzzing approaches (e.g., AFL [53]) can also be used to detect bugs in relational DBMSs.",
          "excerpt_is_verbatim": true,
          "note": "Sentence in this paper citing Non-optimizing Reference Engine Construction (NoREC), as indexed by Semantic Scholar.",
          "retrieved_at": "2026-09-06T15:09:10Z"
        },
        {
          "source_url": "https://doi.org/10.1109/icst60714.2024.00012",
          "source_type": "paper_citation_context",
          "excerpt": "GDBMeter applies query partitioning [20] to test GDBs. Speciﬁcally, it partitions a query into three disjoint queries in which a predicate is evaluated to true , false and null , respectively.",
          "excerpt_is_verbatim": true,
          "note": "Sentence in this paper citing Ternary Logic Partitioning (TLP), as indexed by Semantic Scholar.",
          "retrieved_at": "2026-09-06T15:09:10Z"
        },
        {
          "source_url": "https://doi.org/10.1109/icst60714.2024.00012",
          "source_type": "paper_citation_context",
          "excerpt": "Among these approaches, NoREC [21] can detect optimization bugs in relational database systems by rewriting an optimized SQL query into a non-optimizing SQL query.",
          "excerpt_is_verbatim": true,
          "note": "Sentence in this paper citing Non-optimizing Reference Engine Construction (NoREC), as indexed by Semantic Scholar.",
          "retrieved_at": "2026-09-06T15:09:10Z"
        },
        {
          "source_url": "https://doi.org/10.1109/icst60714.2024.00012",
          "source_type": "paper_citation_context",
          "excerpt": "Many testing approaches [17]–[26] (e.g., TLP [20], NoREC [21], and DQE [25]) have been proposed to test relational database systems.",
          "excerpt_is_verbatim": true,
          "note": "Sentence in this paper citing Non-optimizing Reference Engine Construction (NoREC), as indexed by Semantic Scholar.",
          "retrieved_at": "2026-09-06T15:09:10Z"
        }
      ]
    }
  ]
}
