{
  "schema_version": "1.0.0",
  "policy_version": "impact-policy-v1",
  "paper": {
    "id": "paper:doi:10.1109/iccste65902.2025.11138310",
    "title": "Research on Coverage Statistics in Fuzz Testing of Closed-Source DBMS",
    "authors": [
      "Zhongjie Li",
      "Hao-Tian Liang",
      "Haoyang Jia",
      "Qingxian Wang",
      "Yan Cao"
    ],
    "year": 2025,
    "venue": "2025 International Conference on Computer Science, Technology and Engineering (ICCSTE)",
    "doi": "10.1109/iccste65902.2025.11138310",
    "url": "https://doi.org/10.1109/iccste65902.2025.11138310"
  },
  "summary": {
    "text": "This paper addresses fuzzing closed-source DBMSs, where source instrumentation is unavailable and published vulnerability research is scarce. It proposes collecting real-time coverage by monitoring execution paths, and uses that coverage as feedback for seed scheduling during fuzzing. The resulting coverage tracker, TrCov, was applied to Oracle and SQL Server, with experiments the authors report as validating its effectiveness.",
    "relationship_to_sqlancer": "Coverage collection for DBMS fuzzing where the source is unavailable; SQLancer is cited among DBMS testing work.",
    "is_model_generated": true,
    "grounded_in_source": true,
    "written_from": "abstract",
    "written_from_url": "https://doi.org/10.1109/iccste65902.2025.11138310",
    "source_sha256": "sha256:b6f246599b36c7ae8c71423c58a9dc9eff8b2ddbe1ef3171de55d068fd45460e",
    "supporting_excerpts": [
      "Currently, publicly available research on vulnerability detection for closed-source DBMSs remains relatively limited.",
      "To achieve effective testing of closed-source DBMSs, this paper proposes a novel coverage analysis method based on execution path monitoring to collect real-time coverage data of closed-source DBMSs.",
      "Based on this approach, a coverage tracker named TrCov for closed-source DBMSs was implemented."
    ],
    "model": "claude-opus-5",
    "generated_by": "claude_code_session",
    "classifier_version": null,
    "generated_at": "2026-09-07T02:31:04Z"
  },
  "evidence": [
    {
      "relationship": "references",
      "title": "Cites SQLancer",
      "value": "yes",
      "method": "citation_graph",
      "techniques": [
        "pqs",
        "qpg"
      ],
      "sources": [
        {
          "source_url": "https://doi.org/10.1109/iccste65902.2025.11138310",
          "source_type": "paper_citation_context",
          "excerpt": "SQLancer [4] and Troc [5] employ pre-established oracles to detect logical and transaction isolation errors in DBMSs. APOLLO [6] identifies performance regression issues by comparing different DBMS versions.",
          "excerpt_is_verbatim": true,
          "note": "Sentence in this paper citing Pivoted Query Synthesis (PQS), as indexed by Semantic Scholar.",
          "retrieved_at": "2026-09-06T15:09:10Z"
        }
      ]
    }
  ]
}
