{
  "schema_version": "1.0.0",
  "policy_version": "impact-policy-v1",
  "paper": {
    "id": "paper:doi:10.1145/3650212.3680392",
    "title": "Testing Gremlin-Based Graph Database Systems via Query Disassembling",
    "authors": [
      "Yingying Zheng",
      "Wensheng Dou",
      "Leile Tang",
      "Ziyu Cui",
      "Yu Gao",
      "Jiansen Song",
      "Liangying Xu",
      "Jiaxin Zhu",
      "Wei Wang",
      "Jun Wei",
      "Hua Zhong",
      "Tao Huang"
    ],
    "year": 2024,
    "venue": "International Symposium on Software Testing and Analysis",
    "doi": "10.1145/3650212.3680392",
    "url": "https://doi.org/10.1145/3650212.3680392"
  },
  "summary": {
    "text": "QuDi detects logic bugs in Gremlin-based graph database systems by disassembling a query. Given a Gremlin query, it breaks the query into a sequence of atomic graph traversals with equivalent execution semantics; if the whole query and the disassembled sequence return different results, the system has a logic bug. Evaluated on six popular graph systems it found 25 logic bugs, 10 confirmed as previously unknown.",
    "relationship_to_sqlancer": "A semantics-preserving decomposition oracle for graph databases, in the family of SQLancer's query-transformation oracles.",
    "is_model_generated": true,
    "grounded_in_source": true,
    "written_from": "abstract",
    "written_from_url": "https://doi.org/10.1145/3650212.3680392",
    "source_sha256": "sha256:4f7f3333f09380035c2a4bd80e3d68f59d74d93701ded83249ec9e4f4dcbab96",
    "supporting_excerpts": [
      "However, incorrect implementations and optimizations of GDBs can introduce logic bugs, which can cause Gremlin queries to return incorrect query results, e.g., omitting vertices in a graph database.",
      "In this paper, we propose Query Di sassembling (QuDi), an effective testing technique to automatically detect logic bugs in Gremlin-based GDBs.",
      "Given a Gremlin query Q, QuDi disassembles Q into a sequence of atomic graph traversals TList, which shares the equivalent execution semantics with Q."
    ],
    "model": "claude-opus-5",
    "generated_by": "claude_code_session",
    "classifier_version": null,
    "generated_at": "2026-09-07T02:34:56Z"
  },
  "evidence": [
    {
      "relationship": "references",
      "title": "Cites SQLancer",
      "value": "yes",
      "method": "citation_graph",
      "techniques": [
        "norec",
        "tlp"
      ],
      "sources": [
        {
          "source_url": "https://www.semanticscholar.org/paper/dce7daf3d485e83ae503cfa60e7a0ccce994a764",
          "source_type": "paper",
          "excerpt": null,
          "excerpt_is_verbatim": false,
          "note": "Semantic Scholar records this paper as citing the publication that introduced Non-optimizing Reference Engine Construction (NoREC), Ternary Logic Partitioning (TLP).",
          "retrieved_at": "2026-09-06T15:09:10Z"
        }
      ]
    }
  ]
}
