{
  "schema_version": "1.0.0",
  "policy_version": "impact-policy-v1",
  "paper": {
    "id": "paper:doi:10.1142/s021819402150039x",
    "title": "MTKeras: An Automated Metamorphic Testing Platform",
    "authors": [
      "Ye-Lin Liu",
      "Z. Zhou",
      "T. Chen",
      "Yang Liu",
      "Dave Towey"
    ],
    "year": 2021,
    "venue": "International journal of software engineering and knowledge engineering",
    "doi": "10.1142/s021819402150039x",
    "url": "https://doi.org/10.1142/s021819402150039x"
  },
  "summary": {
    "text": "MTKeras is an automated, domain-independent platform for metamorphic testing. The authors demonstrate it through five case studies across four domains — image classification, sentiment analysis, search engines and database management systems — and additionally study whether combining metamorphic relation input patterns within individual relations improves failure finding. Their experiments support both the combination of patterns and the use of the platform, and the work introduces metamorphic relation patterns as a practical tool for the research community.",
    "relationship_to_sqlancer": "Applies its metamorphic testing platform to database management systems among four domains, citing the DBMS metamorphic testing work.",
    "is_model_generated": true,
    "grounded_in_source": true,
    "written_from": "abstract",
    "written_from_url": "https://doi.org/10.1142/s021819402150039x",
    "source_sha256": "sha256:1b1ed1b3a228314cdfdb862717dbec165c06de13ca33208b54008fd595811510",
    "supporting_excerpts": [
      "This paper presents an automated, domain-independent, metamorphic testing platform called MTKeras.",
      "In this paper, we report on an investigation demonstrating the effectiveness and usability of MTKeras through five case studies in the four domains of image classification, sentiment analysis, search engines and database management systems.",
      "We also report on the effectiveness of combining metamorphic relation (input) patterns in individual metamorphic relations, enhancing the failure-finding abilities of the individual relations."
    ],
    "model": "claude-opus-5",
    "generated_by": "claude_code_session",
    "classifier_version": null,
    "generated_at": "2026-09-07T02:39:53Z"
  },
  "evidence": [
    {
      "relationship": "references",
      "title": "Cites SQLancer",
      "value": "yes",
      "method": "citation_graph",
      "techniques": [
        "pqs",
        "norec"
      ],
      "sources": [
        {
          "source_url": "https://doi.org/10.1142/s021819402150039x",
          "source_type": "paper_citation_context",
          "excerpt": "Researchers developed a novel method called NonOptimizing Reference Engine Construction (NoREC) [6], which compares the results of the optimized and non-optimized versions of a SQL to evaluate the DBMS.",
          "excerpt_is_verbatim": true,
          "note": "Sentence in this paper citing Non-optimizing Reference Engine Construction (NoREC), as indexed by Semantic Scholar.",
          "retrieved_at": "2026-09-06T15:09:10Z"
        },
        {
          "source_url": "https://doi.org/10.1142/s021819402150039x",
          "source_type": "paper_citation_context",
          "excerpt": "It has become recognized as an important quality assurance paradigm for complex systems, such as for machine learning (ML) [4], [5] and database management systems (DBMSs) [6].",
          "excerpt_is_verbatim": true,
          "note": "Sentence in this paper citing Non-optimizing Reference Engine Construction (NoREC), as indexed by Semantic Scholar.",
          "retrieved_at": "2026-09-06T15:09:10Z"
        },
        {
          "source_url": "https://doi.org/10.1142/s021819402150039x",
          "source_type": "paper_citation_context",
          "excerpt": "MTKeras was also configured for database management system (DBMS) testing by using the concept of Non-Optimizing Reference Engine Construction (NoREC) [6].",
          "excerpt_is_verbatim": true,
          "note": "Sentence in this paper citing Non-optimizing Reference Engine Construction (NoREC), as indexed by Semantic Scholar.",
          "retrieved_at": "2026-09-06T15:09:10Z"
        },
        {
          "source_url": "https://doi.org/10.1142/s021819402150039x",
          "source_type": "paper_citation_context",
          "excerpt": "There are multiple methods for detecting bugs in a DBMS, such as Pivoted Query Synthesis (PQS) [47] and Random Generation of SQL (RAGS) [48].",
          "excerpt_is_verbatim": true,
          "note": "Sentence in this paper citing Pivoted Query Synthesis (PQS), as indexed by Semantic Scholar.",
          "retrieved_at": "2026-09-06T15:09:10Z"
        },
        {
          "source_url": "https://doi.org/10.1142/s021819402150039x",
          "source_type": "paper_citation_context",
          "excerpt": "Database management system testing is also challenged by the test oracle problem [6].",
          "excerpt_is_verbatim": true,
          "note": "Sentence in this paper citing Non-optimizing Reference Engine Construction (NoREC), as indexed by Semantic Scholar.",
          "retrieved_at": "2026-09-06T15:09:10Z"
        }
      ]
    }
  ]
}
