{
  "schema_version": "1.0.0",
  "policy_version": "impact-policy-v1",
  "paper": {
    "id": "paper:doi:10.1109/tdsc.2024.3521591",
    "title": "Improving Multitasking DBMS Fuzzing With More Accurate Coverage and Testcase Trimming",
    "authors": [
      "Jiaqi Li",
      "Yajin Zhou",
      "Lei Wu"
    ],
    "year": 2025,
    "venue": "IEEE Transactions on Dependable and Secure Computing",
    "doi": "10.1109/tdsc.2024.3521591",
    "url": "https://doi.org/10.1109/tdsc.2024.3521591"
  },
  "summary": {
    "text": "Tuzz improves coverage-guided DBMS fuzzing on two fronts. First, coverage feedback in existing DBMS fuzzers is imprecise, so the fuzzer cannot choose strategies well; work-task coverage tracking and unstable edge filtering make it more accurate at low instrumentation cost. Second, DBMS fuzzers lack testcase trimming, so inputs grow, execution slows and mutations are less likely to reach interesting structures. With more accurate coverage, trimming becomes practical. Tuzz explored 16-27% more edges than the state-of-the-art fuzzer and found 14 previously unknown bugs in MySQL and MariaDB.",
    "relationship_to_sqlancer": "Coverage-guided DBMS fuzzing, a complementary line to SQLancer's oracle-based approach, which it cites.",
    "is_model_generated": true,
    "grounded_in_source": true,
    "written_from": "abstract",
    "written_from_url": "https://doi.org/10.1109/tdsc.2024.3521591",
    "source_sha256": "sha256:a8ac48bb8ae04fb4f7703d238d60d0a6e85ca276a4a18bcbdb40c89695558650",
    "supporting_excerpts": [
      "First, the coverage feedback is imprecise which prevents fuzzers from making optimal decisions on fuzzing strategies.",
      "Specifically, the work-task coverage tracking and unstable edge filtering improve the coverage accuracy with low instrumentation overhead.",
      "More importantly, Tuzz has discovered 10 and 4 previously unknown bugs in MySQL and MariaDB."
    ],
    "model": "claude-opus-5",
    "generated_by": "claude_code_session",
    "classifier_version": null,
    "generated_at": "2026-09-07T02:29:23Z"
  },
  "evidence": [
    {
      "relationship": "references",
      "title": "Cites SQLancer",
      "value": "yes",
      "method": "citation_graph",
      "techniques": [
        "norec",
        "tlp"
      ],
      "sources": [
        {
          "source_url": "https://doi.org/10.1109/tdsc.2024.3521591",
          "source_type": "paper_citation_context",
          "excerpt": "Thesecondtypeproposesnewtestoraclestoidentifysemantic bugs in DBMSs. NoREC [35], TLP [36], DQE [37], Pinolo [38] leverage the idea of metamorphic testing to identify semantic bugs that lead to the incorrect result of SQL statement.",
          "excerpt_is_verbatim": true,
          "note": "Sentence in this paper citing Non-optimizing Reference Engine Construction (NoREC), as indexed by Semantic Scholar.",
          "retrieved_at": "2026-09-06T15:09:10Z"
        }
      ]
    }
  ]
}
