{
  "schema_version": "1.0.0",
  "policy_version": "impact-policy-v1",
  "paper": {
    "id": "paper:doi:10.1145/3802061",
    "title": "Finding Missed Optimizations in DBMSs through Unbalanced Short-circuit Query Construction",
    "authors": [
      "Jinhui Lai",
      "Chi Zhang",
      "Jie Liang",
      "Zihao Zeng",
      "Zhiyong Wu",
      "Jingzhou Fu",
      "Chijin Zhou",
      "Shuai Ma",
      "Yu Jiang",
      "Zichen Xu"
    ],
    "year": 2026,
    "venue": "Proceedings of the ACM on Management of Data",
    "doi": "10.1145/3802061",
    "url": "https://doi.org/10.1145/3802061"
  },
  "summary": {
    "text": "SCor looks for optimisations a DBMS could have applied but did not. It constructs short-circuit queries whose result is obtainable from low-cost operations alone; if the system nonetheless executes the full query with expensive operations, that is a missed optimisation. The authors argue existing work finds cases where an implemented optimisation performs poorly but rarely reveals ones entirely absent. Across 11 widely used DBMSs SCor found 153 previously undetected performance bugs, 125 confirmed and 33 fixed.",
    "relationship_to_sqlancer": "A performance oracle for DBMSs, related to SQLancer's line of work on automatically deciding whether a system behaved correctly.",
    "is_model_generated": true,
    "grounded_in_source": true,
    "written_from": "abstract",
    "written_from_url": "https://doi.org/10.1145/3802061",
    "source_sha256": "sha256:b04640cf62e85fceb24c153802aa076fc6058e56d381425f113f97d800da028f",
    "supporting_excerpts": [
      "In this paper, we present SCor, a black-box approach for identifying missed optimizations in DBMSs through unbalanced short-circuit query construction.",
      "SCor realizes it by constructing short-circuit queries, where the result can be obtained from low-cost operations alone.",
      "Our evaluation of SCor across 11 widely-used DBMSs, revealed 153 previously undetected performance bugs resulting from missed optimizations, including 2 bugs in Oracle and 3 bugs in PostgreSQL."
    ],
    "model": "claude-opus-5",
    "generated_by": "claude_code_session",
    "classifier_version": null,
    "generated_at": "2026-09-07T02:26:39Z"
  },
  "evidence": [
    {
      "relationship": "references",
      "title": "Cites SQLancer",
      "value": "yes",
      "method": "citation_graph",
      "techniques": [
        "norec",
        "tlp",
        "cert"
      ],
      "sources": [
        {
          "source_url": "https://www.semanticscholar.org/paper/96bb90109a01a144448d9bf9b7b58f3e4c440eff",
          "source_type": "paper",
          "excerpt": null,
          "excerpt_is_verbatim": false,
          "note": "Semantic Scholar records this paper as citing the publication that introduced Non-optimizing Reference Engine Construction (NoREC), Ternary Logic Partitioning (TLP), Cardinality Estimation Restriction Testing (CERT).",
          "retrieved_at": "2026-09-06T15:09:10Z"
        }
      ]
    }
  ]
}
