{
  "schema_version": "1.0.0",
  "policy_version": "impact-policy-v1",
  "paper": {
    "id": "paper:s2:84c637ad3297e0d4e45a4f5245d0472a82a59268",
    "title": "Demystifying and Checking Silent Semantic Violations in Large Distributed Systems",
    "authors": [
      "Chang Lou",
      "Yuzhuo Jing",
      "Peng Huang"
    ],
    "year": 2022,
    "venue": "USENIX Symposium on Operating Systems Design and Implementation",
    "doi": null,
    "url": "https://www.semanticscholar.org/paper/84c637ad3297e0d4e45a4f5245d0472a82a59268"
  },
  "summary": {
    "text": "A paper on silent semantic violations in large distributed systems. Only the sentence citing SQLancer is available here, so this summary is limited to it: the authors survey approaches proposed for detecting semantic bugs in file systems and DBMSs, naming cross-checking of multiple file system implementations, fuzzing, and testing using pivoted queries.",
    "relationship_to_sqlancer": "Cites Pivoted Query Synthesis among the existing approaches to detecting silent semantic bugs.",
    "is_model_generated": true,
    "grounded_in_source": true,
    "written_from": "citation contexts",
    "written_from_url": "https://www.semanticscholar.org/paper/84c637ad3297e0d4e45a4f5245d0472a82a59268",
    "source_sha256": "sha256:169953b50a74da6832ed99491335135dfaa8d0099dda2bb610655b583d543dee",
    "supporting_excerpts": [
      "Several solutions are proposed to detect semantic bugs in ﬁle systems and DBMS, including cross-checking multiple ﬁle system implementations [50], fuzzing [39], and testing using pivoted query [54]."
    ],
    "model": "claude-opus-5",
    "generated_by": "claude_code_session",
    "classifier_version": null,
    "generated_at": "2026-09-07T02:38:27Z"
  },
  "evidence": [
    {
      "relationship": "references",
      "title": "Cites SQLancer",
      "value": "yes",
      "method": "citation_graph",
      "techniques": [
        "pqs"
      ],
      "sources": [
        {
          "source_url": "https://www.semanticscholar.org/paper/84c637ad3297e0d4e45a4f5245d0472a82a59268",
          "source_type": "paper_citation_context",
          "excerpt": "Several solutions are proposed to detect semantic bugs in ﬁle systems and DBMS, including cross-checking multiple ﬁle system implementations [50], fuzzing [39], and testing using pivoted query [54].",
          "excerpt_is_verbatim": true,
          "note": "Sentence in this paper citing Pivoted Query Synthesis (PQS), as indexed by Semantic Scholar.",
          "retrieved_at": "2026-09-06T15:09:10Z"
        }
      ]
    }
  ]
}
