{
  "schema_version": "1.0.0",
  "policy_version": "impact-policy-v1",
  "paper": {
    "id": "paper:arxiv:2601.15074",
    "title": "SmartOracle - An Agentic Approach to Mitigate Noise in Differential Oracles",
    "authors": [
      "Srinath Srinivasan",
      "Tim Menzies",
      "Marcelo d’Amorim"
    ],
    "year": 2026,
    "venue": "arXiv.org",
    "doi": null,
    "url": "https://arxiv.org/abs/2601.15074"
  },
  "summary": {
    "text": "SmartOracle addresses the cost of validating differential fuzzing results for JavaScript engines, where oracles are built by hand, are expensive and false-positive prone, and must be redone as the specification evolves. It decomposes the manual triage workflow into specialised LLM sub-agents that gather evidence from terminal runs and targeted specification queries and combine it into a verdict. On historical benchmarks it reaches 0.84 recall at an 18% false positive rate, and in live campaigns it found specification-level issues in V8, JavaScriptCore and GraalJS.",
    "relationship_to_sqlancer": "Differential-testing triage for JavaScript engines rather than DBMSs; SQLancer is cited as related differential-testing work.",
    "is_model_generated": true,
    "grounded_in_source": true,
    "written_from": "abstract",
    "written_from_url": "https://arxiv.org/abs/2601.15074",
    "source_sha256": "sha256:5eb6adee56199250627e41eb50bb68c004b29be62760c9718805e532b27a113e",
    "supporting_excerpts": [
      "Inspired by the success of agentic systems in other SE domains, this paper introduces SmartOracle.",
      "SmartOracle decomposes the manual triage workflow into specialized Large Language Model (LLM) sub-agents.",
      "For historical benchmarks, SmartOracle achieves 0.84 recall with an 18% false positive rate."
    ],
    "model": "claude-opus-5",
    "generated_by": "claude_code_session",
    "classifier_version": null,
    "generated_at": "2026-09-07T02:27:34Z"
  },
  "evidence": [
    {
      "relationship": "references",
      "title": "Cites SQLancer",
      "value": "yes",
      "method": "citation_graph",
      "techniques": [
        "pqs"
      ],
      "sources": [
        {
          "source_url": "https://arxiv.org/abs/2601.15074",
          "source_type": "paper_citation_context",
          "excerpt": "Research in this domain demonstrates that by endowing agents with persistent memory, explicit objectives, and access to external tools or APIs, these systems can manage significantly more complex and dynamic workflows than prompt chaining alone [19, 54].",
          "excerpt_is_verbatim": true,
          "note": "Sentence in this paper citing Pivoted Query Synthesis (PQS), as indexed by Semantic Scholar.",
          "retrieved_at": "2026-09-06T15:09:10Z"
        }
      ]
    }
  ]
}
