{
  "schema_version": "1.0.0",
  "policy_version": "impact-policy-v1",
  "paper": {
    "id": "paper:arxiv:2511.17377",
    "title": "Anomaly Pattern-guided Transaction Bug Testing in Relational Databases",
    "authors": [
      "Hui-Rong Xu",
      "Shuang Liu",
      "Xianyu Zhu",
      "Qiyu Zhuang",
      "Wei Lu",
      "Xiaoyong Du"
    ],
    "year": 2025,
    "venue": "arXiv.org",
    "doi": null,
    "url": "https://arxiv.org/abs/2511.17377"
  },
  "summary": {
    "text": "APTrans tests transaction handling in relational DBMSs under different isolation levels. The authors identify two obstacles: generating transactions that actually expose bugs, since those bugs need specific transactional constraints, and deciding whether an outcome is wrong, since the correct result of randomly generated transactions is usually unknown. They address the first with generation guided by predefined anomaly patterns and the second with a two-phase explicit and implicit error detection process. On MySQL, MariaDB and OceanBase, APTrans found 13 previously unknown transaction bugs, 11 confirmed.",
    "relationship_to_sqlancer": "Extends automated DBMS testing from single queries to transactions, and the record's artifact evidence shows the implementation reusing the SQLancer codebase.",
    "is_model_generated": true,
    "grounded_in_source": true,
    "written_from": "abstract",
    "written_from_url": "https://arxiv.org/abs/2511.17377",
    "source_sha256": "sha256:427c195fcd255330c2fe1447f7b4e526cf894e95dbc62ee840e0dc4134f505a2",
    "supporting_excerpts": [
      "To address these challenges, we propose an anomaly pattern-guided testing approach for uncovering transaction bugs in RDBMSs.",
      "Our solution tackles the first challenge by introducing a test case generation technique guided by predefined anomaly patterns, which increases the likelihood of exposing transactional bugs.",
      "APTrans successfully identified 13 previously unknown transaction-related bugs, 11 of which have been confirmed by the respective development teams."
    ],
    "model": "claude-opus-5",
    "generated_by": "claude_code_session",
    "classifier_version": null,
    "generated_at": "2026-09-07T02:28:35Z"
  },
  "evidence": [
    {
      "relationship": "references",
      "title": "Cites SQLancer",
      "value": "yes",
      "method": "citation_graph",
      "techniques": [
        "pqs",
        "norec",
        "tlp",
        "qpg"
      ],
      "sources": [
        {
          "source_url": "https://arxiv.org/abs/2511.17377",
          "source_type": "paper_citation_context",
          "excerpt": "Recent innovations have introduced paradigm shifts in testing strategies: QPG [7] uses query plan-guided database state mutation,while DQE[28]appliesdifferentialexecutionanalysisacross SELECT,UPDATE,and DELETEstatements.",
          "excerpt_is_verbatim": true,
          "note": "Sentence in this paper citing Query Plan Guidance (QPG), as indexed by Semantic Scholar.",
          "retrieved_at": "2026-09-06T15:33:21Z"
        },
        {
          "source_url": "https://arxiv.org/abs/2511.17377",
          "source_type": "paper_citation_context",
          "excerpt": "Its successor, SQLancer [25–27], introduces three metamorphic testing oracles: PQS [27], NoREC [25], and TLP [26], significantly improving its ability to detect logical bugs.",
          "excerpt_is_verbatim": true,
          "note": "Sentence in this paper citing Pivoted Query Synthesis (PQS), as indexed by Semantic Scholar.",
          "retrieved_at": "2026-09-06T15:33:21Z"
        }
      ]
    },
    {
      "relationship": "uses_infrastructure",
      "title": "Uses the SQLancer codebase",
      "value": "yes",
      "method": "deterministic",
      "techniques": [],
      "sources": [
        {
          "source_url": "https://arxiv.org/abs/2511.17377",
          "source_type": "paper",
          "excerpt": "We develop our database and SQL statement generation method based on SQLancer [ 4] and extend it to support table join operations for both database generation and SQL statement generation. 3.2.1 Database Generation.",
          "excerpt_is_verbatim": true,
          "note": "The paper states that its implementation is built on SQLancer.",
          "retrieved_at": "2026-09-06T15:33:21Z"
        }
      ]
    },
    {
      "relationship": "extends_technique",
      "title": "Extends a SQLancer technique",
      "value": "yes",
      "method": "deterministic",
      "techniques": [
        "pqs",
        "norec",
        "tlp",
        "qpg"
      ],
      "sources": [
        {
          "source_url": "https://arxiv.org/abs/2511.17377",
          "source_type": "paper",
          "excerpt": "To simulate real-world scenarios, which usually involve multiple tables connected with join keys, we extend SQLancer to support table join operations for both database generation and SQL statement generation.",
          "excerpt_is_verbatim": true,
          "note": "The paper states that it extends or adapts a SQLancer technique.",
          "retrieved_at": "2026-09-06T15:33:21Z"
        }
      ]
    }
  ]
}
