{
  "schema_version": "1.0.0",
  "policy_version": "impact-policy-v1",
  "paper": {
    "id": "paper:doi:10.1109/icse43902.2021.00137",
    "title": "Data-Oriented Differential Testing of Object-Relational Mapping Systems",
    "authors": [
      "T. Sotiropoulos",
      "Stefanos Chaliasos",
      "Vaggelis Atlidakis",
      "Dimitris Mitropoulos",
      "D. Spinellis"
    ],
    "year": 2021,
    "venue": "International Conference on Software Engineering",
    "doi": "10.1109/icse43902.2021.00137",
    "url": "https://doi.org/10.1109/icse43902.2021.00137"
  },
  "summary": {
    "text": "Cynthia is, as far as the authors know, the first systematic approach to testing Object-Relational Mapping systems. It generates random relational schemas, sets up the corresponding databases, and queries them through the APIs of the ORMs under test. Because ORMs share no common input language, queries are written in an abstract query language and translated into concrete executable ORM queries for differential comparison. Since the results depend heavily on the stored data, a solver-based approach produces records targeted at the constraints of each generated query. Cynthia found 28 bugs in five popular ORMs.",
    "relationship_to_sqlancer": "Differential testing with generated schemas and queries, applied one layer above the DBMS; SQLancer is cited among that work.",
    "is_model_generated": true,
    "grounded_in_source": true,
    "written_from": "abstract",
    "written_from_url": "https://doi.org/10.1109/icse43902.2021.00137",
    "source_sha256": "sha256:e23ed5d81417d3cbe2840cf42f38c430fd584524eb71c1e3371583d50c5d1645",
    "supporting_excerpts": [
      "We introduce, what is to the best of our knowledge, the first approach for systematically testing Object-Relational Mapping (ORM) systems.",
      "Our approach leverages differential testing to establish a test oracle for ORM-specific bugs.",
      "We implement our approach as a tool, called CYNTHIA, which found 28 bugs in five popular ORM systems."
    ],
    "model": "claude-opus-5",
    "generated_by": "claude_code_session",
    "classifier_version": null,
    "generated_at": "2026-09-07T02:39:12Z"
  },
  "evidence": [
    {
      "relationship": "references",
      "title": "Cites SQLancer",
      "value": "yes",
      "method": "citation_graph",
      "techniques": [
        "pqs",
        "norec",
        "tlp"
      ],
      "sources": [
        {
          "source_url": "https://doi.org/10.1109/icse43902.2021.00137",
          "source_type": "paper_citation_context",
          "excerpt": "…data generation approach and its suitability for differential testing, we compare it against a simplistic approach that populates the database with random records a-priori [21], [27], i.e., it inserts data while setting up the tables, without considering the constraints of the generated queries.",
          "excerpt_is_verbatim": true,
          "note": "Sentence in this paper citing Pivoted Query Synthesis (PQS), as indexed by Semantic Scholar.",
          "retrieved_at": "2026-09-06T15:09:10Z"
        },
        {
          "source_url": "https://doi.org/10.1109/icse43902.2021.00137",
          "source_type": "paper_citation_context",
          "excerpt": "More recently, Rigger et al. [21] proposed the Pivoted Query Synthesis (PQS) technique for testing database engines.",
          "excerpt_is_verbatim": true,
          "note": "Sentence in this paper citing Pivoted Query Synthesis (PQS), as indexed by Semantic Scholar.",
          "retrieved_at": "2026-09-06T15:09:10Z"
        },
        {
          "source_url": "https://doi.org/10.1109/icse43902.2021.00137",
          "source_type": "paper_citation_context",
          "excerpt": "Although DBMSs share common functionality, they differ signiﬁcantly from each other [21].",
          "excerpt_is_verbatim": true,
          "note": "Sentence in this paper citing Pivoted Query Synthesis (PQS), as indexed by Semantic Scholar.",
          "retrieved_at": "2026-09-06T15:09:10Z"
        },
        {
          "source_url": "https://doi.org/10.1109/icse43902.2021.00137",
          "source_type": "paper_citation_context",
          "excerpt": "In their most recent work, they propose Ternary Logic Partitioning (TLP) [38].",
          "excerpt_is_verbatim": true,
          "note": "Sentence in this paper citing Ternary Logic Partitioning (TLP), as indexed by Semantic Scholar.",
          "retrieved_at": "2026-09-06T15:09:10Z"
        }
      ]
    }
  ]
}
