{
  "schema_version": "1.0.0",
  "policy_version": "impact-policy-v1",
  "paper": {
    "id": "paper:doi:10.1145/3828685",
    "title": "Programmable Property-Based Testing",
    "authors": [
      "A. Keles",
      "Justine Frank",
      "Ceren Mert",
      "Harrison Goldstein",
      "Leonidas Lampropoulos"
    ],
    "year": 2026,
    "venue": "Proceedings of the ACM on Programming Languages",
    "doi": "10.1145/3828685",
    "url": "https://doi.org/10.1145/3828685"
  },
  "summary": {
    "text": "This paper proposes a deeper language for expressing properties in property-based testing. It observes that properties in modern frameworks are written in shallowly embedded DSLs and tightly coupled to how they are run, so users are limited to whatever configuration the framework authors anticipated. The alternative, a mixed embedding the authors call deferred binding abstract syntax, reifies a property as a data structure and separates it from the runner that executes it. They implement it in Rocq and Racket and prototype a variety of property runners on top.",
    "relationship_to_sqlancer": "Concerns the expression of properties in general-purpose testing frameworks; SQLancer is cited as an application of property-style oracles.",
    "is_model_generated": true,
    "grounded_in_source": true,
    "written_from": "abstract",
    "written_from_url": "https://doi.org/10.1145/3828685",
    "source_sha256": "sha256:4cd94f490b22a53f0bd069e40f96e512a4253b606693af55d0ee71aa8e26794e",
    "supporting_excerpts": [
      "We propose a new, deeper language for properties based on a mixed embedding that we call deferred binding abstract syntax, which reifies properties as a data structure and decouples them from the property runners that execute them.",
      "We implement this language in Rocq and Racket, leveraging the power of dependent and dynamic types, respectively."
    ],
    "model": "claude-opus-5",
    "generated_by": "claude_code_session",
    "classifier_version": null,
    "generated_at": "2026-09-07T02:27:34Z"
  },
  "evidence": [
    {
      "relationship": "references",
      "title": "Cites SQLancer",
      "value": "yes",
      "method": "citation_graph",
      "techniques": [
        "qpg"
      ],
      "sources": [
        {
          "source_url": "https://www.semanticscholar.org/paper/1b21dbf4dfd10358f77bf5ba3b9ba39c81e18b25",
          "source_type": "paper",
          "excerpt": null,
          "excerpt_is_verbatim": false,
          "note": "Semantic Scholar records this paper as citing the publication that introduced Query Plan Guidance (QPG).",
          "retrieved_at": "2026-09-06T15:09:10Z"
        }
      ]
    }
  ]
}
